{
  "code": "GB",
  "name": "United Kingdom",
  "documentTerm": "CV",
  "pageSize": "A4",
  "pageCountExpectation": "2",
  "photo": "forbidden",
  "discouragedPersonalFields": ["dateOfBirth", "maritalStatus", "nationality", "photo", "gender"],
  "nameOrder": "given-family",
  "dateFormat": "MMM yyyy",
  "currency": "GBP",
  "legalClauses": ["gdpr-consent"],
  "notes": "Equality Act 2010 anti-discrimination norms: omit photo, date of birth, marital status, nationality, and gender to avoid bias on protected characteristics. Standard length is around two A4 pages. Personal data is covered by UK GDPR, so include a data-processing consent line where appropriate."
}
